title	url	form_number	description
Mon Accompagnateur Rénov’ : synthèse des pièces justificatives communiquées dans le dossier de demande d’agrément (auditeurs énergétiques, entreprises RGE « offre globale », sociétés de tiers-financement) (Formulaire 17109*01)	https://www.service-public.gouv.fr/particuliers/vosdroits/R68723	17109*01	""
Mon Accompagnateur Rénov' : récapitulatif de la demande d'agrément comprenant une synthèse des pièces justificatives communiquées dans le dossier de demande d’agrément (Formulaire 17110*01)	https://www.service-public.gouv.fr/particuliers/vosdroits/R68724	17110*01	""
Mon Accompagnateur Rénov’ : synthèse des pièces justificatives communiquées dans le dossier de demande d’agrément par les collectivités territoriales ou leurs groupements (Formulaire 17111*01)	https://www.service-public.gouv.fr/particuliers/vosdroits/R68726	17111*01	""
Demande d’inscription sur la liste électorale consulaire : contestation de radiation (recours en méconnaissance de l’article 7 de la loi n°76-97)	https://www.service-public.gouv.fr/particuliers/vosdroits/R68754		""
Demande de reconnaissance de l'état d'invalidité temporaire des fonctionnaires (Formulaire 16950*01)	https://www.service-public.gouv.fr/particuliers/vosdroits/R68843	16950*01	""
Déclaration d'usage de substances dites « précurseurs de drogues » rentrant dans la composition de drogues (Formulaire 16340*01)	https://www.service-public.gouv.fr/particuliers/vosdroits/R68887	16340*01	""
Demande de duplicata d'un permis de chasser suite à un changement d'état civil (hors nom d'usage) (Formulaire 16863*01)	https://www.service-public.gouv.fr/particuliers/vosdroits/R70792	16863*01	""
Fiva - Demande d'indemnisation par la victime (formulaire)	https://www.service-public.gouv.fr/particuliers/vosdroits/R69013		""
Allocations et prestations familiales - Déclaration de ressources 2022 par courrier (Formulaire 10397*26)	https://www.service-public.gouv.fr/particuliers/vosdroits/R69214	10397*26	""
Aide au logement Déclaration de charges déductibles et pensions alimentaires - Année 2023 (Formulaire 16019*05)	https://www.service-public.gouv.fr/particuliers/vosdroits/R69300	16019*05	""
Déclaration de ressources - Année 2022 pour la détermination des droits à l'aide au logement (Formulaire 16020*05)	https://www.service-public.gouv.fr/particuliers/vosdroits/R69302	16020*05	""
Demander la modification d’une autorisation délivrée en cours de validité ou de régularisation (Formulaire 16700*01)	https://www.service-public.gouv.fr/particuliers/vosdroits/R70975	16700*01	""
Déclaration pour le recalcul de l'aide au logement (Formulaire 16018*05)	https://www.service-public.gouv.fr/particuliers/vosdroits/R69303	16018*05	""
Annexe aux formulaires de demande d'autorisation d'urbanisme : Références cadastrales complémentaires	https://www.service-public.gouv.fr/particuliers/vosdroits/R70997		""
Déclaration de ressources mensuelles sur 12 mois pour la détermination des droits à l'aide au logement (Formulaire 16021*05)	https://www.service-public.gouv.fr/particuliers/vosdroits/R69304	16021*05	""
Aide au logement Déclaration de ressources Chiffres d'affaires/recettes sur 12 mois (Formulaire 16023*05)	https://www.service-public.gouv.fr/particuliers/vosdroits/R69305	16023*05	""
Aide au logement Déclaration de ressources Chiffres d'affaires/recettes sur 3 mois (Formulaire 16022*04)	https://www.service-public.gouv.fr/particuliers/vosdroits/R69306	16022*04	""
Demande d'admission au bénéfice des rémunérations pour les bénéficiaires de l'offre de repérage et de remobilisation (Formulaire 17565*01)	https://www.service-public.gouv.fr/particuliers/vosdroits/R71090	17565*01	""
Formulaires administratifs (cerfas)	https://www.service-public.fr/particuliers/recherche?rubricFilter=serviceEnLigne&rubricTypeFilter=formulaire		""
Demande d'attestation d'accueil	https://www.service-public.gouv.fr/particuliers/vosdroits/R10751		""
Demande d'inscription sur les listes électorales	https://www.service-public.gouv.fr/particuliers/vosdroits/R16024		""
Demande de certificat d'immatriculation d'un véhicule	https://www.service-public.gouv.fr/particuliers/vosdroits/R13567		""
Prêt avance mutation ne portant pas intérêt (également appelé Prêt avance rénovation - PAR +) : formulaire Emprunteur	https://www.service-public.gouv.fr/particuliers/vosdroits/R69735		""
Prêt avance mutation ne portant pas intérêt (également appelé Prêt avance rénovation - PAR +) : formulaire Entreprise (tous travaux sauf travaux améliorant la performance énergétique globale du logement)	https://www.service-public.gouv.fr/particuliers/vosdroits/R69736		""
Prêt avance mutation ne portant pas intérêt (également appelé Prêt avance rénovation - PAR +) : formulaire Entreprise Performance énergétique globale	https://www.service-public.gouv.fr/particuliers/vosdroits/R69825		""
Mon Accompagnateur Rénov’ : Conditions de réalisation de l’ensemble des activités (Formulaire 16446*01)	https://www.service-public.gouv.fr/particuliers/vosdroits/R70243	16446*01	""
Demande d’agrément d’accueillant familial (Formulaire 17564*01)	https://www.service-public.gouv.fr/particuliers/vosdroits/R70267	17564*01	""
Annexe « Personne remplaçante » au formulaire de demande d’agrément d’accueillant familial (Formulaire 17564*01)	https://www.service-public.gouv.fr/particuliers/vosdroits/R70268	17564*01	""
Formulaire de demande d’accès des personnes nées d’une AMP à l’identité et aux données non identifiantes du tiers donneur	https://www.service-public.gouv.fr/particuliers/vosdroits/R71411		""
Déclaration conjointe de dissolution d'un Pacs (Formulaire 15789*03)	https://www.service-public.gouv.fr/particuliers/vosdroits/R73180	15789*03	""
Attestation employeur pour vos régimes de retraite - Retraite progressive	https://www.service-public.gouv.fr/particuliers/vosdroits/R73270		""
Demande de réversion de la pension et de la retraite additionnelle à la suite du décès d’un fonctionnaire de l’État, d’un magistrat ou d’un militaire retraité (Formulaire 11979*12)	https://www.service-public.gouv.fr/particuliers/vosdroits/R71480	11979*12	""
Demande de conciliation par un conciliateur de justice	https://www.service-public.gouv.fr/particuliers/vosdroits/R73714		""
Demande de rente temporaire d'éducation ou de rente viagère pour handicap à la suite du décès en activité d'un agent contractuel de l'État ou d'un ouvrier de l'État (Formulaire 17446*01)	https://www.service-public.gouv.fr/particuliers/vosdroits/R71720	17446*01	""
Demande de mise à jour des actes de l’état civil à la suite d’un changement de nom autorisé par décret (Formulaire 17585*01)	https://www.service-public.gouv.fr/particuliers/vosdroits/R73748	17585*01	""
Déclaration simplifiée d'un dommage corporel causé par un tiers (Formulaire 16341*01)	https://www.service-public.gouv.fr/particuliers/vosdroits/R71854	16341*01	""
Demande de RSA (Mayotte) (Formulaire 14584*01)	https://www.service-public.gouv.fr/particuliers/vosdroits/R931	14584*01	""
Demande de prêt à l'amélioration du lieu d'accueil (PALA) ou prêt à l'amélioration de l'habitat (PAH) pour les assistantes maternelles (Formulaire 14073*02)	https://www.service-public.gouv.fr/particuliers/vosdroits/R71914	14073*02	""
Ordonnance bizone (Formulaire 14465*01)	https://www.service-public.gouv.fr/particuliers/vosdroits/R973	14465*01	""
Demande de prêt à l'amélioration de l'habitat (PAH) de la MSA (Formulaire 11382*03)	https://www.service-public.gouv.fr/particuliers/vosdroits/R71916	11382*03	""
Formulaires administratifs (cerfas)	https://www.service-public.fr/particuliers/recherche?rubricFilter=serviceEnLigne&rubricTypeFilter=formulaire		""
Demande d'attestation d'accueil	https://www.service-public.gouv.fr/particuliers/vosdroits/R10751		""
Demande d'inscription sur les listes électorales	https://www.service-public.gouv.fr/particuliers/vosdroits/R16024		""
Demande de certificat d'immatriculation d'un véhicule	https://www.service-public.gouv.fr/particuliers/vosdroits/R13567		""
Déclaration de ressources et activité salariée (orphelin d'au moins 21 ans atteint d’un handicap qui demande une pension d’invalidité à la suite du décès d'un parent militaire) (Formulaire 17574*01)	https://www.service-public.gouv.fr/particuliers/vosdroits/R71923	17574*01	""
Demande de prise en charge du bilan de compétences (FPH)	https://www.service-public.gouv.fr/particuliers/vosdroits/R72198		""
Éco-PTZ individuel : formulaire remplissable en ligne Emprunteur tous travaux éligibles	https://www.service-public.gouv.fr/particuliers/vosdroits/R72545		""
Éco-PTZ individuel et copropriété : formulaire remplissable en ligne Entreprise Assainissement	https://www.service-public.gouv.fr/particuliers/vosdroits/R72546		""
Éco-PTZ individuel et copropriété : formulaire remplissable en ligne Entreprise Performance globale (métropole)	https://www.service-public.gouv.fr/particuliers/vosdroits/R72548		""
Éco-PTZ individuel et copropriété : formulaire remplissable en ligne Entreprise Performance globale (Dom)	https://www.service-public.gouv.fr/particuliers/vosdroits/R72549		""
Éco-PTZ copropriété : formulaire papier Emprunteur tous travaux éligibles	https://www.service-public.gouv.fr/particuliers/vosdroits/R72550		""
Éco-PTZ copropriété : formulaire remplissable en ligne Emprunteur tous travaux éligibles	https://www.service-public.gouv.fr/particuliers/vosdroits/R72552		""
Éco-PTZ individuel et copropriété : formulaire remplissable en ligne Entreprise réalisation d'une ou plusieurs actions de rénovation énergétique (métropole)	https://www.service-public.gouv.fr/particuliers/vosdroits/R72553		""
Éco-PTZ individuel et copropriété : formulaire remplissable en ligne Entreprise réalisation d'une ou plusieurs actions de rénovation énergétique (Dom)	https://www.service-public.gouv.fr/particuliers/vosdroits/R72554		""
Demande de bulletin n°3 du casier judiciaire (Formulaire 10071*18)	https://www.service-public.gouv.fr/particuliers/vosdroits/R72642	10071*18	""
Déclaration de capture accidentelle d'espadon ou de thon germon dans le cadre de la pêche de loisir en mer Méditerranée (Formulaire 17578*01)	https://www.service-public.gouv.fr/particuliers/vosdroits/R72747	17578*01	""
Demande d'avis de l'autorité organisatrice de l'accueil du jeune enfant (Formulaire 17579*01)	https://www.service-public.gouv.fr/particuliers/vosdroits/R73033	17579*01	""
Demande d'autorisation de création, d’extension, de transformation, de modification d’un établissement ou d’un service d’accueil du jeune enfant, et de demande de renouvellement et de modification du titulaire de l’autorisation (Formulaire 17580*01)	https://www.service-public.gouv.fr/particuliers/vosdroits/R73034	17580*01	""
Bordereau d’envoi des pièces n° 12 à 15 du formulaire de demande d'autorisation de création, d’extension ou de transformation d’un établissement ou d’un service d’accueil du jeune enfant (Formulaire 17581*01)	https://www.service-public.gouv.fr/particuliers/vosdroits/R73035	17581*01	""
Attestation de travaux d’amélioration de la performance énergétique pouvant donner lieu à une participation du locataire du parc privé	https://www.service-public.gouv.fr/particuliers/vosdroits/R73121		""
Attestation de travaux d’amélioration de la performance énergétique pouvant donner lieu à une participation du locataire du parc public	https://www.service-public.gouv.fr/particuliers/vosdroits/R73122		""
Déclaration 2025 des revenus 2024 (papier) (Formulaire 10330)	https://www.service-public.gouv.fr/particuliers/vosdroits/R1281	10330	""
Fonctionnaire de l'État, magistrat ou militaire décédé en activité - Demande de pension de réversion et de rente d’éducation ou handicap (Formulaire 12231*08)	https://www.service-public.gouv.fr/particuliers/vosdroits/R10692	12231*08	""
Formulaires administratifs (cerfas)	https://www.service-public.fr/particuliers/recherche?rubricFilter=serviceEnLigne&rubricTypeFilter=formulaire		""
Demande d'attestation d'accueil	https://www.service-public.gouv.fr/particuliers/vosdroits/R10751		""
Demande d'inscription sur les listes électorales	https://www.service-public.gouv.fr/particuliers/vosdroits/R16024		""
Demande de certificat d'immatriculation d'un véhicule	https://www.service-public.gouv.fr/particuliers/vosdroits/R13567		""
Demande de prise en charge d'hospitalisation au titre de l'article L.212-1 du code des pensions militaires d'invalidité et des victimes de guerre (CPMIVG) (Formulaire 14448*04)	https://www.service-public.gouv.fr/particuliers/vosdroits/R10762	14448*04	""
Déclaration de contrat de prêt (Formulaire 10142)	https://www.service-public.gouv.fr/particuliers/vosdroits/R1087	10142	""
Déclaration récapitulative des opérations sur valeurs mobilières et revenus de capitaux mobiliers (Formulaire 11428)	https://www.service-public.gouv.fr/particuliers/vosdroits/R10883	11428	""
Déclarer son médecin traitant (Formulaire 12485*03)	https://www.service-public.gouv.fr/particuliers/vosdroits/R10884	12485*03	""
Premier certificat de santé (Formulaire 12596*04)	https://www.service-public.gouv.fr/particuliers/vosdroits/R10917	12596*04	""
Attestation de travaux d'amélioration de la performance énergétique pouvant donner lieu à une participation du locataire du parc public (Formulaire 13967*01)	https://www.service-public.gouv.fr/particuliers/vosdroits/R10933	13967*01	""
Demande d'agrément d'une association d'usagers du système de santé - Fiche A (Formulaire 12623*02)	https://www.service-public.gouv.fr/particuliers/vosdroits/R10946	12623*02	""
Déclaration de candidature aux concours nationaux d'agrégation pour le recrutement des professeurs des universités (Formulaire 11430*01)	https://www.service-public.gouv.fr/particuliers/vosdroits/R11172	11430*01	""
Demande de renouvellement d'agrément d'une association d'usagers du système de santé - Fiche A bis (Formulaire 14161*01)	https://www.service-public.gouv.fr/particuliers/vosdroits/R11224	14161*01	""
RSA - Demande complémentaire pour un jeune de moins de 25 ans (Formulaire 14130*02)	https://www.service-public.gouv.fr/particuliers/vosdroits/R11225	14130*02	""
Demander l'exonération de la taxe d'habitation pour chambres d'hôtes et meublés de tourisme situés en zone France de revitalisation rurale (ZFRR ou ZFRR+) (Formulaire 13567*02)	https://www.service-public.gouv.fr/particuliers/vosdroits/R11242	13567*02	""
Exonérations de taxes foncières sur les propriétés non bâties (déclaration n° 6707-SD) (Formulaire 11998*02)	https://www.service-public.gouv.fr/particuliers/vosdroits/R11273	11998*02	""
Modèle d'attestation de témoin (Formulaire 11527*03)	https://www.service-public.gouv.fr/particuliers/vosdroits/R11307	11527*03	""
Mandat pour effectuer les formalités d'immatriculation (Formulaire 13757*03)	https://www.service-public.gouv.fr/particuliers/vosdroits/R1137	13757*03	""
Propriétaire occupant : déclaration du nouveau propriétaire (Anah) (Formulaire 13465*04)	https://www.service-public.gouv.fr/particuliers/vosdroits/R11452	13465*04	""
Certificat international d'importation de matériels de guerre et matériels assimilés (Formulaire 14728*01)	https://www.service-public.gouv.fr/particuliers/vosdroits/R11485	14728*01	""
Demande de bourse de collège (Formulaire 12539*15)	https://www.service-public.gouv.fr/particuliers/vosdroits/R11499	12539*15	""
Demande de permis de construire pour une maison individuelle et/ou ses annexes (PCMI) (Formulaire 13406*15)	https://www.service-public.gouv.fr/particuliers/vosdroits/R11637	13406*15	""
Déclaration préalable constructions et travaux non soumis à permis de construire (Formulaire 16702*01)	https://www.service-public.gouv.fr/particuliers/vosdroits/R11646	16702*01	""
Demande d’aide financière médico-sociale auprès de la caisse nationale militaire de sécurité sociale (CNMSS) (Formulaire 13343*11)	https://www.service-public.gouv.fr/particuliers/vosdroits/R12056	13343*11	""
Formulaires administratifs (cerfas)	https://www.service-public.fr/particuliers/recherche?rubricFilter=serviceEnLigne&rubricTypeFilter=formulaire		""
Demande d'attestation d'accueil	https://www.service-public.gouv.fr/particuliers/vosdroits/R10751		""
Demande d'inscription sur les listes électorales	https://www.service-public.gouv.fr/particuliers/vosdroits/R16024		""
Demande de certificat d'immatriculation d'un véhicule	https://www.service-public.gouv.fr/particuliers/vosdroits/R13567		""
Demande d'autorisation de loterie - actes de bienfaisance – encouragement des arts – financement d'activités sportives à but non lucratif (Formulaire 11823*03)	https://www.service-public.gouv.fr/particuliers/vosdroits/R12059	11823*03	""
Déclaration d'accident (en dehors d'une mission et hors service) à la Caisse nationale militaire de sécurité sociale (CNMSS) (Formulaire 11360*14)	https://www.service-public.gouv.fr/particuliers/vosdroits/R12060	11360*14	""
Propriétaire bailleur : demander une convention Anah avec travaux (loyer social, très social, intermédiaire) (Formulaire 14039*06)	https://www.service-public.gouv.fr/particuliers/vosdroits/R12062	14039*06	""
Propriétaire occupant : demande de versement d'une avance pour commencer les travaux (Anah) (Formulaire 13934*05)	https://www.service-public.gouv.fr/particuliers/vosdroits/R12064	13934*05	""
Demande d'attribution du titre d'évadé (Formulaire 11051*02)	https://www.service-public.gouv.fr/particuliers/vosdroits/R12065	11051*02	""
Syndicat des copropriétaires : demande de versement d'une avance pour commencer les travaux (Anah) (Formulaire 13933*06)	https://www.service-public.gouv.fr/particuliers/vosdroits/R12130	13933*06	""
Demande ou renouvellement d'autorisation d'usage à des fins thérapeutiques (AUT) de substances dopantes	https://www.service-public.gouv.fr/particuliers/vosdroits/R12139		""
Déclaration de don manuel et de don de sommes d'argent (Formulaire 11278)	https://www.service-public.gouv.fr/particuliers/vosdroits/R1224	11278	""
Procuration en cas de désignation d'un mandataire (Anah) (Formulaire 13463*02)	https://www.service-public.gouv.fr/particuliers/vosdroits/R123	13463*02	""
Déclaration d'un local hébergeant des mineurs (Formulaire 12751*01)	https://www.service-public.gouv.fr/particuliers/vosdroits/R1236	12751*01	""
Déclaration de changement de situation au centre du service national et de la jeunesse (CSNJ) (Formulaire 11718*05)	https://www.service-public.gouv.fr/particuliers/vosdroits/R1249	11718*05	""
Demande de regroupement familial (Formulaire 11436*05)	https://www.service-public.gouv.fr/particuliers/vosdroits/R1251	11436*05	""
Déclaration modèle H1 - Maison individuelle et autre construction individuelle isolée (Formulaire 10867)	https://www.service-public.gouv.fr/particuliers/vosdroits/R1252	10867	""
Propriétaire bailleur : demander une convention Anah sans travaux (loyer intermédiaire) (Formulaire 12807*08)	https://www.service-public.gouv.fr/particuliers/vosdroits/R12524	12807*08	""
Déclaration modèle H2 - Appartement et dépendances dans un immeuble collectif (Formulaire 10869)	https://www.service-public.gouv.fr/particuliers/vosdroits/R1253	10869	""
Enquête sociale - Majoration pour assistance constante d'une tierce personne (Formulaire 13974*02)	https://www.service-public.gouv.fr/particuliers/vosdroits/R10103	13974*02	""
Demander une aide ménagère à domicile à la caisse nationale militaire de sécurité sociale (CNMSS) (Formulaire 13344*11)	https://www.service-public.gouv.fr/particuliers/vosdroits/R12536	13344*11	""
Expertise médicale - majoration pour assistance constante d'une tierce personne (Formulaire 13975*02)	https://www.service-public.gouv.fr/particuliers/vosdroits/R10107	13975*02	""
Changement de consistance ou d'affectation des propriétés bâties et non bâties (déclaration n° 6704) (Formulaire 10517)	https://www.service-public.gouv.fr/particuliers/vosdroits/R1254	10517	""
Demande de pension d'invalidité (Formulaire 11174*05)	https://www.service-public.gouv.fr/particuliers/vosdroits/R1261	11174*05	""
Formulaires administratifs (cerfas)	https://www.service-public.fr/particuliers/recherche?rubricFilter=serviceEnLigne&rubricTypeFilter=formulaire		""
Demande d'attestation d'accueil	https://www.service-public.gouv.fr/particuliers/vosdroits/R10751		""
Demande d'inscription sur les listes électorales	https://www.service-public.gouv.fr/particuliers/vosdroits/R16024		""
Demande de certificat d'immatriculation d'un véhicule	https://www.service-public.gouv.fr/particuliers/vosdroits/R13567		""
Opposition à une injonction de payer (Formulaire 15602*04)	https://www.service-public.gouv.fr/particuliers/vosdroits/R10223	15602*04	""
Déclaration 2025 des revenus 2024 encaissés à l'étranger (Formulaire 11226)	https://www.service-public.gouv.fr/particuliers/vosdroits/R10243	11226	""
Demande d'aide médicale de l'État (AME) (Formulaire 11573*09)	https://www.service-public.gouv.fr/particuliers/vosdroits/R1266	11573*09	""
Déclaration 2025 des revenus 2024 - Départ à l'étranger ou retour en France (Formulaire 11942)	https://www.service-public.gouv.fr/particuliers/vosdroits/R10245	11942	""
Voter par procuration (Formulaire 14952*03)	https://www.service-public.gouv.fr/particuliers/vosdroits/R12675	14952*03	""
Demande de permis de visite (prison) (Formulaire 13960*02)	https://www.service-public.gouv.fr/particuliers/vosdroits/R1027	13960*02	""
Déclaration de succession (Formulaire 11277, 12322 et 12321)	https://www.service-public.gouv.fr/particuliers/vosdroits/R10279	11277	""
Association : demande de subvention (Formulaire 12156*06)	https://www.service-public.gouv.fr/particuliers/vosdroits/R1271	12156*06	""
Validation des acquis de l'expérience (VAE) - Demande de recevabilité (Formulaire 12818*02)	https://www.service-public.gouv.fr/particuliers/vosdroits/R10282	12818*02	""
Demande d'évaluation de rachat pour la retraite de vos années d'études supérieures (Formulaire 14136*05)	https://www.service-public.gouv.fr/particuliers/vosdroits/R12713	14136*05	""
Demander un état signalétique et des services (Légion étrangère)	https://www.service-public.gouv.fr/particuliers/vosdroits/R12720		""
Contrat de professionnalisation (Formulaire 12434*05)	https://www.service-public.gouv.fr/particuliers/vosdroits/R10338	12434*05	""
Propriétaire bailleur : demander une convention Anah sans travaux (loyer social ou très social) (Formulaire 12808*09)	https://www.service-public.gouv.fr/particuliers/vosdroits/R1052	12808*09	""
Dossier vert (étudiant étranger) : demande d'admission préalable en université - 1ère année de licence ou Paces - 2023-2024	https://www.service-public.gouv.fr/particuliers/vosdroits/R1278		""
Demande d'admission préalable à l'inscription en première année de licence dans une université française pour l'année universitaire 2023-2024	https://www.service-public.gouv.fr/particuliers/vosdroits/R1279		""
Déclaration de changement de situation à la Caisse nationale militaire de sécurité sociale (CNMSS) (Formulaire 12621*06)	https://www.service-public.gouv.fr/particuliers/vosdroits/R1571	12621*06	""
Déclaration complémentaire 2025 des revenus 2024 (Formulaire 11222)	https://www.service-public.gouv.fr/particuliers/vosdroits/R1282	11222	""
Demande de carte grise (certificat d'immatriculation) - Véhicule neuf (Formulaire 13749*05)	https://www.service-public.gouv.fr/particuliers/vosdroits/R14220	13749*05	""
Déclaration n°2044 des revenus fonciers (Formulaire 10334)	https://www.service-public.gouv.fr/particuliers/vosdroits/R1283	10334	""
Demande de mutation (évolution de la situation professionnelle entraînant un changement de régime de Sécurité sociale)	https://www.service-public.gouv.fr/particuliers/vosdroits/R1422		""
Formulaires administratifs (cerfas)	https://www.service-public.fr/particuliers/recherche?rubricFilter=serviceEnLigne&rubricTypeFilter=formulaire		""
Demande d'attestation d'accueil	https://www.service-public.gouv.fr/particuliers/vosdroits/R10751		""
Demande d'inscription sur les listes électorales	https://www.service-public.gouv.fr/particuliers/vosdroits/R16024		""
Demande de certificat d'immatriculation d'un véhicule	https://www.service-public.gouv.fr/particuliers/vosdroits/R13567		""
Déclaration des plus ou moins-values réalisées (Formulaire 11905)	https://www.service-public.gouv.fr/particuliers/vosdroits/R1286	11905	""
Requête aux fins de saisine du tribunal judiciaire ou du tribunal de proximité (Formulaire 16042*02)	https://www.service-public.gouv.fr/particuliers/vosdroits/R14232	16042*02	""
"Demande du titre de prisonnier du ""Viêt-Minh"" (Formulaire 10861*02)"	https://www.service-public.gouv.fr/particuliers/vosdroits/R1290	10861*02	""
Demande d'accord préalable (Assurance maladie, maternité, accident du travail, maladie professionnelle) (Formulaire 12040*04)	https://www.service-public.gouv.fr/particuliers/vosdroits/R1424	12040*04	""
Demande d'accord préalable - Examens de biologie médicale (Formulaire 10128*04)	https://www.service-public.gouv.fr/particuliers/vosdroits/R1426	10128*04	""
Demande de prêt à l'amélioration de l'habitat (PAH) de la Caf (Formulaire 11382*03)	https://www.service-public.gouv.fr/particuliers/vosdroits/R1293	11382*03	""
Demande d'adhésion à une convention d'allocation spéciale du Fonds national de l'emploi (AS-FNE) (Formulaire 11562*02)	https://www.service-public.gouv.fr/particuliers/vosdroits/R1297	11562*02	""
Traitement d'orthopédie dento-faciale - Demande d'entente préalable chirurgien dentiste (Formulaire 10518*01)	https://www.service-public.gouv.fr/particuliers/vosdroits/R1427	10518*01	""
Demande d'attribution du titre de déporté ou interné résistant (Formulaire 10873*02)	https://www.service-public.gouv.fr/particuliers/vosdroits/R1298	10873*02	""
