title	url	form_number	description
Demande de règlement des petits litiges en Europe	https://www.service-public.gouv.fr/particuliers/vosdroits/R60623		""
Demande de quitus fiscal (Formulaire 15291)	https://www.service-public.gouv.fr/particuliers/vosdroits/R60652	15291	""
Demande d'indemnisation du congé de maternité (Formulaire 15411*01)	https://www.service-public.gouv.fr/particuliers/vosdroits/R60886	15411*01	""
Demande de pension militaire d’invalidité - victime de terrorisme	https://www.service-public.gouv.fr/particuliers/vosdroits/R60895		""
Formulaire complémentaire - Déclaration de transport d'argent liquide entre la France (métropole, DOM et Saint Martin) et l'Union européenne	https://www.service-public.gouv.fr/particuliers/vosdroits/R59467		""
Formulaire complémentaire - Déclaration de transport d'argent liquide entre la France (métropole, DOM et Saint Martin) et l'étranger	https://www.service-public.gouv.fr/particuliers/vosdroits/R59469		""
Certificat médical de contre-indication à la vaccination COVID-19 (Formulaire 16183*02)	https://www.service-public.gouv.fr/particuliers/vosdroits/R61073	16183*02	""
Formulaire complémentaire - Déclaration de transport d'argent liquide entre les collectivités d'outre mer et l'étranger	https://www.service-public.gouv.fr/particuliers/vosdroits/R59472		""
Voter par procuration - Nouvelle-Calédonie (Formulaire 16199*01)	https://www.service-public.gouv.fr/particuliers/vosdroits/R61220	16199*01	""
Demande d'aide à la vie familiale et sociale (AVFS) (Formulaire 16149*01)	https://www.service-public.gouv.fr/particuliers/vosdroits/R61419	16149*01	""
Aide à la vie familiale et sociale (AVFS) - Déclaration de ressources (Formulaire 16150*01)	https://www.service-public.gouv.fr/particuliers/vosdroits/R61421	16150*01	""
Formulaires administratifs (cerfas)	https://www.service-public.fr/particuliers/recherche?rubricFilter=serviceEnLigne&rubricTypeFilter=formulaire		""
Demande d'attestation d'accueil	https://www.service-public.gouv.fr/particuliers/vosdroits/R10751		""
Demande d'inscription sur les listes électorales	https://www.service-public.gouv.fr/particuliers/vosdroits/R16024		""
Demande de certificat d'immatriculation d'un véhicule	https://www.service-public.gouv.fr/particuliers/vosdroits/R13567		""
Demande d'allocation journalière de présence parentale (AJPP) CAF (Formulaire 12666*03)	https://www.service-public.gouv.fr/particuliers/vosdroits/R15336	12666*03	""
Demande de copie d'une décision de justice en matière civile, sociale ou commerciale (Formulaire 11808*06)	https://www.service-public.gouv.fr/particuliers/vosdroits/R1408	11808*06	""
Dossier jaune : demande d'admission préalable à l'inscription dans les cycles d'études des écoles nationales supérieures d'architecture pour l'année 2026-2027 (Formulaire 11962*25)	https://www.service-public.gouv.fr/particuliers/vosdroits/R15643	11962*25	""
Déclaration des bénéfices non commerciaux (BNC) - Régime de la déclaration contrôlée (Formulaire 11176)	https://www.service-public.gouv.fr/particuliers/vosdroits/R14113	11176	""
Prescription médicale de transport (Formulaire 11574*06)	https://www.service-public.gouv.fr/particuliers/vosdroits/R15649	11574*06	""
Déclaration des bénéfices industriels et commerciaux (BIC) (Formulaire 11085)	https://www.service-public.gouv.fr/particuliers/vosdroits/R14120	11085	""
Demander le plafonnement de la taxe foncière de l'habitation principale en fonction des revenus (Formulaire 14770)	https://www.service-public.gouv.fr/particuliers/vosdroits/R14142	14770	""
Dossier de demande de permis de détention d'un chien dangereux (Formulaire 13996*01)	https://www.service-public.gouv.fr/particuliers/vosdroits/R15679	13996*01	""
Déclaration de perte ou vol d'une carte grise (Formulaire 13753*04)	https://www.service-public.gouv.fr/particuliers/vosdroits/R1417	13753*04	""
Protocole de soins (Formulaire 11626*07)	https://www.service-public.gouv.fr/particuliers/vosdroits/R15682	11626*07	""
Demande de délivrance de certificat(s) W garage (Formulaire 13752*02)	https://www.service-public.gouv.fr/particuliers/vosdroits/R14217	13752*02	""
Feuille d'accident du travail ou maladie professionnelle pour les salariés agricoles (Formulaire 11451*04)	https://www.service-public.gouv.fr/particuliers/vosdroits/R19398	11451*04	""
Demande au juge aux affaires familiales (autorité parentale, droit de visite, pension alimentaire...) (Formulaire 11530*11)	https://www.service-public.gouv.fr/particuliers/vosdroits/R15764	11530*11	""
Mandat de protection future (Formulaire 13592*04)	https://www.service-public.gouv.fr/particuliers/vosdroits/R17967	13592*04	""
Déclaration d'un restaurant ou d'un débit de boissons à consommer sur place ou à emporter pour l'obtention d'une licence (vente d'alcools) (Formulaire 11542*05)	https://www.service-public.gouv.fr/particuliers/vosdroits/R15902	11542*05	""
Crédit d'impôt mécénat - Fiche d'aide au calcul (Formulaire 15438)	https://www.service-public.gouv.fr/particuliers/vosdroits/R18024	15438	""
Demande de retraite de réversion (employés et clercs de notaires) (Formulaire 12283*03)	https://www.service-public.gouv.fr/particuliers/vosdroits/R15957	12283*03	""
Élections européennes : demande d'inscription d'un citoyen européen (Formulaire 12671*02)	https://www.service-public.gouv.fr/particuliers/vosdroits/R16025	12671*02	""
Redevance pour protection du milieu aquatique - Déclaration au titre de l'année (Formulaire 13748*05)	https://www.service-public.gouv.fr/particuliers/vosdroits/R18121	13748*05	""
Formulaires administratifs (cerfas)	https://www.service-public.fr/particuliers/recherche?rubricFilter=serviceEnLigne&rubricTypeFilter=formulaire		""
Demande d'attestation d'accueil	https://www.service-public.gouv.fr/particuliers/vosdroits/R10751		""
Demande d'inscription sur les listes électorales	https://www.service-public.gouv.fr/particuliers/vosdroits/R16024		""
Demande de certificat d'immatriculation d'un véhicule	https://www.service-public.gouv.fr/particuliers/vosdroits/R13567		""
M4 NE Déclaration de radiation ou de cessation d'activité des entités de droit privé ne relevant pas des formalités d'entreprises (Formulaire 16279*01)	https://www.service-public.gouv.fr/particuliers/vosdroits/R64048	16279*01	""
Demande d'allocation de maternité pour les pensionnés résidents en Nouvelle-Calédonie (Formulaire 16265*01)	https://www.service-public.gouv.fr/particuliers/vosdroits/R64130	16265*01	""
Demande d’allocation familiale pour les pensionnés résidents en Nouvelle-Calédonie (Formulaire 16259*01)	https://www.service-public.gouv.fr/particuliers/vosdroits/R64131	16259*01	""
Demande d'une allocation maternité pour les pensionnés résidents en Polynésie française (Formulaire 16257*01)	https://www.service-public.gouv.fr/particuliers/vosdroits/R64132	16257*01	""
Demande d'un accompagnement social par Action logement	https://www.service-public.gouv.fr/particuliers/vosdroits/R62521		""
Demande d'allocation spéciale aux enfants handicapés pour les pensionnés résidents en Polynésie française (Formulaire 16262*01)	https://www.service-public.gouv.fr/particuliers/vosdroits/R64137	16262*01	""
Demande d'allocation versée en cas de décès de l'enfant - 16 / 25 ans (Caf)	https://www.service-public.gouv.fr/particuliers/vosdroits/R62552		""
Demande de prime à la naissance pour les pensionnés résidents à Wallis et Futuna (Formulaire 16263*01)	https://www.service-public.gouv.fr/particuliers/vosdroits/R64138	16263*01	""
Demande de changement de nom de famille (Formulaire 16229*03)	https://www.service-public.gouv.fr/particuliers/vosdroits/R62576	16229*03	""
Demande d'allocation familiale pour les pensionnés résidents en Polynésie Française (Formulaire 16260*01)	https://www.service-public.gouv.fr/particuliers/vosdroits/R64139	16260*01	""
Demande d'accord préalable de transport - prescription médicale de transport (Formulaire 11575*07)	https://www.service-public.gouv.fr/particuliers/vosdroits/R62614	11575*07	""
Demande d'allocation prénatale pour les pensionnés résidents en Nouvelle-Calédonie (Formulaire 16264*01)	https://www.service-public.gouv.fr/particuliers/vosdroits/R64140	16264*01	""
Demande d'entente préalable pour un traitement d'assistance respiratoire de longue durée à domicile	https://www.service-public.gouv.fr/particuliers/vosdroits/R62615		""
Demande d'allocation familiale pour les pensionnés résidents à Wallis et Futuna (Formulaire 16261*01)	https://www.service-public.gouv.fr/particuliers/vosdroits/R64141	16261*01	""
Demande d'une allocation prénatale pour les pensionnés résidents en Polynésie française (Formulaire 16258*01)	https://www.service-public.gouv.fr/particuliers/vosdroits/R64142	16258*01	""
Demande de droit au compte de dépôt (personne physique)	https://www.service-public.gouv.fr/particuliers/vosdroits/R62631		""
Désignation du vétérinaire sanitaire par le responsable du centre de rassemblement temporaire ou permanent d'animaux ou de la manifestation (Formulaire 15881*01)	https://www.service-public.gouv.fr/particuliers/vosdroits/R64321	15881*01	""
Obtenir un rescrit en matière d'affichage des prix (Formulaire 15787*01)	https://www.service-public.gouv.fr/particuliers/vosdroits/R62668	15787*01	""
DICEM - Déclaration et identification de certains engins motorisés : quad, mini moto, dirt bike, moto-cross… - Déclaration d’un changement : coordonnées, état civil d'une personne physique et/ou informations d'une personne morale (Formulaire 16230*03)	https://www.service-public.gouv.fr/particuliers/vosdroits/R62679	16230*03	""
Demander un permis de transfert d'armes à feu et de munitions vers un pays non européen (Formulaire 14942)	https://www.service-public.gouv.fr/particuliers/vosdroits/R62829	14942	""
Formulaires administratifs (cerfas)	https://www.service-public.fr/particuliers/recherche?rubricFilter=serviceEnLigne&rubricTypeFilter=formulaire		""
Demande d'attestation d'accueil	https://www.service-public.gouv.fr/particuliers/vosdroits/R10751		""
Demande d'inscription sur les listes électorales	https://www.service-public.gouv.fr/particuliers/vosdroits/R16024		""
Demande de certificat d'immatriculation d'un véhicule	https://www.service-public.gouv.fr/particuliers/vosdroits/R13567		""
Demande de certificat de nationalité française (Formulaire 16237*02)	https://www.service-public.gouv.fr/particuliers/vosdroits/R63143	16237*02	""
Demande d’aides à l’autonomie à domicile pour les personnes âgées (Formulaire 16301*01)	https://www.service-public.gouv.fr/particuliers/vosdroits/R64469	16301*01	""
Demande de changement de prénom (Formulaire 16233*04)	https://www.service-public.gouv.fr/particuliers/vosdroits/R63177	16233*04	""
Demande d'agrément d'une structure d'accueil et d'accompagnement des personnes sous main de justice faisant l'objet d'une mesure de placement à l'extérieur - Procédure accélérée (Formulaire 16217*01)	https://www.service-public.gouv.fr/particuliers/vosdroits/R64506	16217*01	""
Demande de changement de prénom d'un enfant mineur (Formulaire 16234*03)	https://www.service-public.gouv.fr/particuliers/vosdroits/R63178	16234*03	""
Demande de réparation prévue à l'article 3 de la loi n°2022-229 du 23 février 2022 (Formulaire 16215*02)	https://www.service-public.gouv.fr/particuliers/vosdroits/R64507	16215*02	""
Requête au fins de convocation du conseil de famille d'un mineur (Formulaire 16231*01)	https://www.service-public.gouv.fr/particuliers/vosdroits/R63180	16231*01	""
Demande d'agrément d'une structure d'accueil et d'accompagnement des personnes sous main de justice faisant l'objet d'une mesure de placement à l'extérieur (Formulaire 16214*01)	https://www.service-public.gouv.fr/particuliers/vosdroits/R64508	16214*01	""
Diagnostic social et financier (Formulaire 16227*01)	https://www.service-public.gouv.fr/particuliers/vosdroits/R63181	16227*01	""
Recueil de l'accord écrit de l'occupant ou de son représentant légal lors du contrôle dans les locaux, lieux, installations et moyens de transport à usage d'habitation (Formulaire 16210*01)	https://www.service-public.gouv.fr/particuliers/vosdroits/R64509	16210*01	""
Maladie à déclaration obligatoire - Orthopoxviroses (dont la variole) (Formulaire 12218*04)	https://www.service-public.gouv.fr/particuliers/vosdroits/R63186	12218*04	""
Demande d'effacement d'un signalement au fichier automatisé des empreintes digitales adressée au président de la chambre de l'instruction (Formulaire 16192*02)	https://www.service-public.gouv.fr/particuliers/vosdroits/R64518	16192*02	""
Demande d'effacement d'un signalement au fichier automatisé des empreintes digitales adressée au procureur de la République (Formulaire 16191*02)	https://www.service-public.gouv.fr/particuliers/vosdroits/R64519	16191*02	""
Demande d'aide familiale - Caisse nationale militaire de sécurité sociale (Formulaire 17174*01)	https://www.service-public.gouv.fr/particuliers/vosdroits/R64520	17174*01	""
Demande d'aide ménagère aux familles - Caisse nationale militaire de sécurité sociale (Formulaire 16173*01)	https://www.service-public.gouv.fr/particuliers/vosdroits/R64521	16173*01	""
Maladie à déclaration obligatoire Infection à virus West-Nile (ou virus du Nil occidental) (Formulaire 16158*01)	https://www.service-public.gouv.fr/particuliers/vosdroits/R64526	16158*01	""
Maladie à déclaration obligatoire Infection à virus Tick-Borne Encephalitis (TBE) (Formulaire 16157*01)	https://www.service-public.gouv.fr/particuliers/vosdroits/R64527	16157*01	""
Syndicat des copropriétaires : demande de subvention copropriété en difficulté (Anah) (Formulaire 16235*01)	https://www.service-public.gouv.fr/particuliers/vosdroits/R63304	16235*01	""
MaPrimeRénov' Copropriété : demande de subvention pour travaux de rénovation énergétique (Anah) (Formulaire 16236*01)	https://www.service-public.gouv.fr/particuliers/vosdroits/R63305	16236*01	""
Formulaires administratifs (cerfas)	https://www.service-public.fr/particuliers/recherche?rubricFilter=serviceEnLigne&rubricTypeFilter=formulaire		""
Demande d'attestation d'accueil	https://www.service-public.gouv.fr/particuliers/vosdroits/R10751		""
Demande d'inscription sur les listes électorales	https://www.service-public.gouv.fr/particuliers/vosdroits/R16024		""
Demande de certificat d'immatriculation d'un véhicule	https://www.service-public.gouv.fr/particuliers/vosdroits/R13567		""
Déclaration de transfert de résidence hors de France (Formulaire 15717*01)	https://www.service-public.gouv.fr/particuliers/vosdroits/R63307	15717*01	""
Demande de subvention pour des travaux réalisés dans le cadre du dispositif d'intervention immobilière et foncière (Anah) (Formulaire 16272*01)	https://www.service-public.gouv.fr/particuliers/vosdroits/R65074	16272*01	""
Vente d'immeuble à rénover (VIR) : demande de subvention pour travaux (Anah) (Formulaire 16270*01)	https://www.service-public.gouv.fr/particuliers/vosdroits/R65075	16270*01	""
DICEM - Déclaration et identification de certains engins motorisés : quad, mini moto, dirt bike, moto-cross… - Déclaration de vente d'un engin neuf par un vendeur professionnel pour le compte d'un acquéreur (Formulaire 16241*02)	https://www.service-public.gouv.fr/particuliers/vosdroits/R65154	16241*02	""
Demande de remboursement des frais de transport des stagiaires de la formation professionnelle (Formulaire 13926*02)	https://www.service-public.gouv.fr/particuliers/vosdroits/R63942	13926*02	""
Demande de retraite progressive d’un fonctionnaire de l’État ou d’un magistrat (Formulaire 16315*01)	https://www.service-public.gouv.fr/particuliers/vosdroits/R66958	16315*01	""
Demande de remboursement du malus CO2 et du malus masse des véhicules de tourisme pour les personnes ayant 3 enfants à charge ou plus - Véhicules immatriculés en 2024 et en 2025	https://www.service-public.gouv.fr/particuliers/vosdroits/R67066		""
Facture de transport Véhicule sanitaire léger (VSL) et ambulance (Formulaire 11163*03)	https://www.service-public.gouv.fr/particuliers/vosdroits/R65311	11163*03	""
Demande d’autorisation spéciale de travaux en abords de monuments historiques ou dans un site patrimonial remarquable (Formulaire 16291*01)	https://www.service-public.gouv.fr/particuliers/vosdroits/R65385	16291*01	""
Récépissé de dépôt d’une demande d’autorisation spéciale de travaux en abords de monuments historiques ou dans un site patrimonial remarquable	https://www.service-public.gouv.fr/particuliers/vosdroits/R65507		""
Demande d'allocation journalière de présence parentale (AJPP) - MSA (Formulaire 12666*05)	https://www.service-public.gouv.fr/particuliers/vosdroits/R67539	12666*05	""
Maladie à déclaration obligatoire Leptospirose (Formulaire 16292*01)	https://www.service-public.gouv.fr/particuliers/vosdroits/R65780	16292*01	""
MaPrimeRénov' : attestation d'exclusivité CEE - Rénovation d'ampleur (Anah)	https://www.service-public.gouv.fr/particuliers/vosdroits/R68007		""
Demande d'attribution de l'allocation spéciale aux pensionnés (Formulaire 16294*01)	https://www.service-public.gouv.fr/particuliers/vosdroits/R65908	16294*01	""
MaPrimeRénov' : attestation de travaux - Rénovation d'ampleur - devis (Anah)	https://www.service-public.gouv.fr/particuliers/vosdroits/R68091		""
Formulaires administratifs (cerfas)	https://www.service-public.fr/particuliers/recherche?rubricFilter=serviceEnLigne&rubricTypeFilter=formulaire		""
Demande d'attestation d'accueil	https://www.service-public.gouv.fr/particuliers/vosdroits/R10751		""
Demande d'inscription sur les listes électorales	https://www.service-public.gouv.fr/particuliers/vosdroits/R16024		""
Demande de certificat d'immatriculation d'un véhicule	https://www.service-public.gouv.fr/particuliers/vosdroits/R13567		""
Relevé individuel des temps d'activité prud'homale (Formulaire 13704*03)	https://www.service-public.gouv.fr/particuliers/vosdroits/R19374	13704*03	""
Déclaration de maladie professionnelle pour les salariés agricoles (Formulaire 10131*05)	https://www.service-public.gouv.fr/particuliers/vosdroits/R19393	10131*05	""
Déclaration de maladie professionnelle - Exploitant agricole (Formulaire 13661*04)	https://www.service-public.gouv.fr/particuliers/vosdroits/R19395	13661*04	""
Attestation d'employeur pour la retraite progressive (Formulaire 13362*02)	https://www.service-public.gouv.fr/particuliers/vosdroits/R17964	13362*02	""
Demande de pension d'invalidité des salariés agricoles (Formulaire 11980*03)	https://www.service-public.gouv.fr/particuliers/vosdroits/R19408	11980*03	""
Demande de bourse nationale d'études du second degré (enseignement agricole) (Formulaire 11779*11)	https://www.service-public.gouv.fr/particuliers/vosdroits/R21220	11779*11	""
Demande de pension - Assurance d'invalidité des non-salariés agricoles (Formulaire 11981*04)	https://www.service-public.gouv.fr/particuliers/vosdroits/R19409	11981*04	""
Demande d'allocation journalière d'accompagnement à domicile d'une personne en fin de vie (Formulaire 14555*01)	https://www.service-public.gouv.fr/particuliers/vosdroits/R19466	14555*01	""
Propriétaire occupant : plan de financement (Anah) (Formulaire 13460*03)	https://www.service-public.gouv.fr/particuliers/vosdroits/R21223	13460*03	""
Création d'une association (Formulaire 13973*04)	https://www.service-public.gouv.fr/particuliers/vosdroits/R19467	13973*04	""
Déclaration de candidature au concours de maître de conférences des universités - praticien hospitalier des centres de soins, d'enseignement et de recherche dentaires (Formulaire 11435*01)	https://www.service-public.gouv.fr/particuliers/vosdroits/R21234	11435*01	""
Modification d'une association (titre, objet, siège social, adresse de gestion, dissolution) (Formulaire 13972*03)	https://www.service-public.gouv.fr/particuliers/vosdroits/R19468	13972*03	""
Récépissé de déclaration d'ouverture, de mutation, de translation d'un restaurant ou d'un débit de boissons à consommer sur place ou à emporter (preuve de la licence) (Formulaire 11543*05)	https://www.service-public.gouv.fr/particuliers/vosdroits/R21288	11543*05	""
Demander l'aide au recouvrement	https://www.service-public.gouv.fr/particuliers/vosdroits/R19507		""
Demander la modification d’une autorisation délivrée en cours de validité ou de régularisation (Formulaire 16700*01)	https://www.service-public.gouv.fr/particuliers/vosdroits/R21323	16700*01	""
Demande de permis d'aménager (Formulaire 16297*03)	https://www.service-public.gouv.fr/particuliers/vosdroits/R21378	16297*03	""
Certificat médical d'accouchement pour faire établir un acte d'enfant sans vie (Formulaire 13773*02)	https://www.service-public.gouv.fr/particuliers/vosdroits/R19553	13773*02	""
Demande d'indemnisation auprès du FGAO de l'ayant droit (décès de la victime d'accident de la circulation/chasse)	https://www.service-public.gouv.fr/particuliers/vosdroits/R21646		""
Demande de certificat d'urbanisme (Formulaire 13410*12)	https://www.service-public.gouv.fr/particuliers/vosdroits/R1970	13410*12	""
Carnet de pêche à l'anguille (Formulaire 14358*01)	https://www.service-public.gouv.fr/particuliers/vosdroits/R21844	14358*01	""
Formulaires administratifs (cerfas)	https://www.service-public.fr/particuliers/recherche?rubricFilter=serviceEnLigne&rubricTypeFilter=formulaire		""
Demande d'attestation d'accueil	https://www.service-public.gouv.fr/particuliers/vosdroits/R10751		""
Demande d'inscription sur les listes électorales	https://www.service-public.gouv.fr/particuliers/vosdroits/R16024		""
Demande de certificat d'immatriculation d'un véhicule	https://www.service-public.gouv.fr/particuliers/vosdroits/R13567		""
Demande de taux personnalisé et/ou d'acomptes de prélèvement à la source (Formulaire 15944)	https://www.service-public.gouv.fr/particuliers/vosdroits/R66343	15944	""
Propriétaire occupant : demande de paiement d'acompte (Anah) (Formulaire 13467*02)	https://www.service-public.gouv.fr/particuliers/vosdroits/R68128	13467*02	""
Formulaire de demande d'historique des contrôles Techniques de votre véhicule	https://www.service-public.gouv.fr/particuliers/vosdroits/R68188		""
Demande d'autorisation de travail au titre des métiers en tension (formulaire)	https://www.service-public.gouv.fr/particuliers/vosdroits/R68232		""
Demande de légalisation internationale	https://www.service-public.gouv.fr/particuliers/vosdroits/R68315		""
Demande de retraite à la suite d’un cumul emploi-retraite	https://www.service-public.gouv.fr/particuliers/vosdroits/R66554		""
Attestation sur l'honneur pour le paiement des indemnités journalières	https://www.service-public.gouv.fr/particuliers/vosdroits/R68581		""
Mon Accompagnateur Rénov' : méthodologie proposée pour l’accompagnement des ménages dans le cadre de l'agrément (Formulaire 17101*01)	https://www.service-public.gouv.fr/particuliers/vosdroits/R68705	17101*01	""
Mon Accompagnateur Rénov' : système qualité et contrôle interne de la structure candidate à l'agrément (Formulaire 17102*01)	https://www.service-public.gouv.fr/particuliers/vosdroits/R68706	17102*01	""
Déclaration des plus ou moins-values de cessions d'actifs numériques (Formulaire 16043)	https://www.service-public.gouv.fr/particuliers/vosdroits/R70452	16043	""
Mon Accompagnateur Rénov' : attestation d’engagement de transmission du rapport annuel d'activité (dans le cadre de la demande d'agrément) – Personne morale (Formulaire 17103*01)	https://www.service-public.gouv.fr/particuliers/vosdroits/R68708	17103*01	""
Mon Accompagnateur Rénov' : attestation d’engagement de transmission du rapport annuel d'activité (dans le cadre de la demande d'agrément) – Personne physique (Formulaire 17104*01)	https://www.service-public.gouv.fr/particuliers/vosdroits/R68710	17104*01	""
Mon Accompagnateur Rénov' : liste des périmètres d’intervention demandés et des implantations territoriales (demande d'agrément) (Formulaire 17100*01)	https://www.service-public.gouv.fr/particuliers/vosdroits/R68716	17100*01	""
Requête en adoption simple de l'enfant majeur du conjoint, partenaire ou concubin (Formulaire 17568*01)	https://www.service-public.gouv.fr/particuliers/vosdroits/R70540	17568*01	""
Mon Accompagnateur Rénov' : attestation d’engagement de suivi du plan de formation complémentaire aux compétences requises et cohérent avec les missions de l'accompagnateur – Personne morale (Formulaire 17105*01)	https://www.service-public.gouv.fr/particuliers/vosdroits/R68717	17105*01	""
Mon Accompagnateur Rénov' : attestation d’engagement de suivi du plan de formation complémentaire aux compétences requises et cohérent avec les missions de l'accompagnateur – Personne physique (Formulaire 17106*01)	https://www.service-public.gouv.fr/particuliers/vosdroits/R68719	17106*01	""
Mon Accompagnateur Rénov' : attestation sur l’honneur de non-condamnation et de situation – Personne morale (Formulaire 17107*01)	https://www.service-public.gouv.fr/particuliers/vosdroits/R68721	17107*01	""
Mon Accompagnateur Rénov' : attestation sur l’honneur de non-condamnation et de situation – Personne physique (Formulaire 17108*01)	https://www.service-public.gouv.fr/particuliers/vosdroits/R68722	17108*01	""
Formulaires administratifs (cerfas)	https://www.service-public.fr/particuliers/recherche?rubricFilter=serviceEnLigne&rubricTypeFilter=formulaire		""
Demande d'attestation d'accueil	https://www.service-public.gouv.fr/particuliers/vosdroits/R10751		""
Demande d'inscription sur les listes électorales	https://www.service-public.gouv.fr/particuliers/vosdroits/R16024		""
Demande de certificat d'immatriculation d'un véhicule	https://www.service-public.gouv.fr/particuliers/vosdroits/R13567		""
